{
  "name": "git-ape",
  "description": "Intelligent Azure deployment agent system for GitHub Copilot. Provides guided, safe, and validated Azure resource deployments using ARM templates, with built-in security analysis, cost estimation, drift detection, and CI/CD pipeline integration.",
  "version": "0.0.1",
  "author": {
    "name": "Microsoft",
    "url": "https://github.com/Azure/git-ape-private"
  },
  "homepage": "https://github.com/Azure/git-ape-private",
  "repository": "https://github.com/Azure/git-ape-private",
  "license": "MIT",
  "keywords": [
    "azure",
    "cloud",
    "infrastructure",
    "arm-templates",
    "deployment",
    "devops",
    "iac",
    "security",
    "cost-estimation",
    "github-actions"
  ],
  "agents": ".github/agents/",
  "skills": ".github/skills/"
}
